Type;Record;Author;Year;Journal;Title;Series;Published;Volume;Pages;Date;ShortTitle;Label;Keywords;Abstract;Language;Notes
  Book;712; K. A. Yudin and L. V. Firsova;1988;; The Common Gull. (in Russian); Ptitsy SSSR. Chaykovye. (Birds of the USSR. Larids); Moscow;;182-199;1988; The Common Gull. (in Russian);6440; Barents Sea, White  Sea, Common Gull, Distribution, Population size, Breeding, Diet, Foraging, Behaviour, Habitat, Movement;;;
  Book;713; K. A. Yudin and L. V. Firsova;1988;; The Kittiwake. (in Russian); Ptitsy SSSR. Chaykovye. (Birds of the USSR. Larids); Moscow;;215-226;1988; The Kittiwake. (in Russian);6450; Barents Sea, White Sea, Kittiwake, Distribution, Population size, Breeding, Diet, Foraging, Behaviour, Habitat, Movements, Predators, Parasites, Management;;;
  Book;727; V. A. Zubakin;1988;; The Common Tern and the Arctic Tern. (in Russian); Ptitsy SSSR. Chaykovye (Birds of the USSR. Larids); Moscow;;321-348;1988; The Common Tern and the Arctic Tern. (in Russian);2690; Barents Sea, White Sea, Common Tern, Arctic Tern, Behaviour, Distribution, Habitat, Moult, Diet, Foraging, Movements, Phenology, Biometry, Population size;;;
  Book;728; V. A. Zubakin;1988;; The Little Gull; Ptitsy SSSR. Chaykovye. (Birds of the USSR. Larids); Moscow;;233-244;1988; The Little Gull;6040; White Sea, Little Gull, Distribtion;; Russian;
;729; V. A. Zubakin, A. A. Kishchinski, V. E. Flint and V. O. Avdanin;1988;; The Ross' Gull; Ptitsy SSSR. Chaykovye  (Birds of the USSR. Larids); Moscow;;244-258;1988; The Ross' Gull;2700; Ross' Gull, Distribution, Movements, Red list species;; Russian;
;447;;1989;; Ekologicheskaya situatsiya v moryakh Severnoy Evropy (na primere Barentseva Morya). (The ecological situation in the nothern european seas (on the sample of the Barents Sea). (in Russian);; Apatity;;31;1989; Ekologicheskaya situatsiya v moryakh Severnoy Evropy (na primere Barentseva Morya). (The ecological situation in the nothern european seas (on the sample of the Barents Sea). (in Russian);4630; Barents Sea, Alcids, Gulls, Management;;;
  Book;120; V. V. Biancki and N. S. Boyko;1989;; Seasonal distribution of birds of the Kandalasha Bay and adjacent territories based upon ringing data. (in Russian); Ecologiya ptits morskikh ostrovov i poberezhij Kolskogo Severa (Bird ecology at the shores of sea islands of the Kola North); Murmansk;;128-147;1989; Seasonal distribution of birds of the Kandalasha Bay and adjacent territories based upon ringing data. (in Russian);2300; White Sea, Many Orders, Distribution, Banding, Movements;;;
  Book;389; A. S. Koryakin;1989;; Feeding behaviour of Common Eider chichs. (in Russian); Ecologiya ptits morskikh ostrovov i poberezhij Kolskogo Severa. (The ecology of birds of the sea islands and coasts of the Kola North); Murmansk;;27-40;1989; Feeding behaviour of Common Eider chichs. (in Russian);3770; White Sea, Common Eider, Breeding, Behaviour;;;
  Book;390; A. S. Koryakin;1989;; Causes of the changes in the brood composition of Common Eider in the Kandalaksha Bay, and evaluation of comparative chicks survival. (in Russian); Ekologiya ptits morskikh ostrovov i poberezhij  Kolskogo Severa. (Bird ecology of sea islands and coasts of the Kola North); Murmansk;;77-88;1989; Causes of the changes in the brood composition of Common Eider in the Kandalaksha Bay, and evaluation of comparative chicks survival. (in Russian);3860; White Sea, Common Eider, Breeding, Foraging, Behaviour;;;
  Book Section;761; A. S. Koryakin, V. V. Bianki, V. D. Kokhanov and F. N. Shklyarevich;1989;; Distribution of nesting Common Eiders on islands of the Kandalaksha Bay;; Moscow;;56-73;; Distribution of nesting Common Eiders on islands of the Kandalaksha Bay;; Kandalaksha Bay, Common Eider, Breeding, Distribution, Conservation;; Russian;
;394; A. S. Koryakin and Y. V. Krasnov;1989;; The influence of antropogenic disturbing on the distribution and survival of the chicks of the Common Eider in the Kandalaksha Bay and on the eastern Murman; Ekologiya ptits morskikh ostrovov i poberezhij Kolskogo Severa.(Ecology of birds of sea islands and coasts of Kola North); Murmansk;;88-101;1989; The influence of antropogenic disturbing on the distribution and survival of the chicks of the Common Eider in the Kandalaksha Bay and on the eastern Murman;3880; Barents sea, Murman, White sea, Common Eider, Breeding, Disturbance;;;
  Thesis;406; Y. V. Krasnov;1989;; Feeding strategies of the gulls of the Eastern Murman. (in Russian);; Moscow;;22;1989; Feeding strategies of the gulls of the Eastern Murman. (in Russian);4370; Barents Sea, Murman, Gulls, Foraging, Diet, Population size, Breeding, Behaviour;;; Autoreferate
  Book;407; Y. V. Krasnov;1989;; Cleptoparasitism of larger Gulls in concentrations of seabirds in the eastern Murman. (in Russian); Ekologiya ptits morskikh ostrovov i poberezhij Kolskogo Severa. (Ecology of birds at the sea islands and coasts of the Kola North); Murmansk;;55-62;1989; Cleptoparasitism of larger Gulls in concentrations of seabirds in the eastern Murman. (in Russian);4380; Barents Sea, Murman, Gulls, Foraging, Diet, Breeding, Behaviour;;;
  Book;408; Y. V. Krasnov;1989;; The diet and peculiarities in the behaviour of gulls under the conditions of multiyear fishfood deficit. (in Russian); Ekologiya ptits morskikh ostrovov i poberezhij Kolskogo Severa. (Ecology of birds of the sea islands and coasts of the Kola North); Murmansk;;11-26;1989; The diet and peculiarities in the behaviour of gulls under the conditions of multiyear fishfood deficit. (in Russian);4390; Barents Sea, Murman, Gulls, Diet, Foraging, Behaviour, Prey stock;;;
  Conference Proceedings;471; Y. N. Mineev;;; The distribution and number of waterbirds at the Yugorski Peninsula. (in Russian);; Ufa;2;362-364;1989; The distribution and number of waterbirds at the Yugorski Peninsula. (in Russian);4860; Barents Sea, Nenets District, Geese, Ducks, Distribution;;;
  Book;500; T. D. Paneva;1989;; The concentrations of nonbreeding gulls in the vicinity of Murmansk-city. (in Russian); Ecologiya ptits morskikh ostrovov i poberezhij Kolskogo Severa. (Ecology of the birds on Kola North sea islands and coasts); Murmansk;;63-71;1989; The concentrations of nonbreeding gulls in the vicinity of Murmansk-city. (in Russian);5020; Barents Sea, Murman, Gulls, Distribution, Foraging, Movements;;;
  Book;625; I. P. Tatarinkova;1989;; Larger Gulls time table in dependence on the conditions of food resources during the nesting period.(in Russian); Ekologiya ptits morskikh ostrovov i poberezhij Kolskogo Severa. (Ecology of birds of the sea islands and coasts of Kola North); Murmansk;;5-11;1989; Larger Gulls time table in dependence on the conditions of food resources during the nesting period.(in Russian);5590; Barents Sea, Murman, Great Black-backed Gull, Herring Gull, Foraging, Behaviour, Prey stock;;;
  Book;626; I. P. Tatarinkova;1989;; The ecology of Black Guillemot in the nesting period at the Ainov Islands. (in Russian); Ekologiay ptits morskikh ostrovov i poberezhij Kolskogo Severa. (Ecology of birds at the sea islands and coasts of the Kola North); Murmansk;;40-55;1989; The ecology of Black Guillemot in the nesting period at the Ainov Islands. (in Russian);5600; Barents Sea, Murman, Black Guillemot, Breeding, Diet, Behaviour, Population size, Predators, Management;;;
  Book;642; I. P. Tatarinkova, Shklyarevich, F. N., Paneva, T. D.;1989;; Variability in the shape of the eggs of Common Eider.  (in Russian); Ekologiya ptits morskikh ostrovov i poberezhij Kolskogo Severa. (Ecology of birds of sea islands and coast of Kola North); Murmansk;;71-77;1989; Variability in the shape of the eggs of Common Eider.  (in Russian);5740; Barents Sea, Murman, Common Eider, Breeding, Biometry;;;
  Book;164; A. E. Cherenkov, Semashko, V. Yu.;1990;; Nesting of Sheld Duck in the White Sea. (in Russian); Ornitologiya. (Ornithology); Moscow;24;165;1990; Nesting of Sheld Duck in the White Sea. (in Russian);6180; White Sea, Sheld duck, Breeding;;;
  Book;258; A. N. Golovkin;1990;; The Common Guillemot and the Brunnich's Guillemot. (in Russian); Ptitsy SSSR. Chistikovye (Birds of the USSR. Alcids); Moscow;;8-16;1990; The Common Guillemot and the Brunnich's Guillemot. (in Russian);2590; Barents Sea, Murman, Novaya Zemlya, Common Murre, Thick-billed Murre, Behavior, Distribution, Habitat, Moult, Diet, Foraging, Movements, Physiology, Population size, Breeding, Predators;;;
  Book;259; A. N. Golovkin;1990;; Little Auk. (in Russian); Ptitsy SSSR. Chistikovye (Birds of the USSR. Alcids); Moscow;;8-16;1990; Little Auk. (in Russian);2600; Barents Sea, Novaya Zemlya, Frans Josef Land, Little Auk, Behavior, Distribution, Habitat, Diet, Foraging, Biometry;;;
  Book;373; V. D. Kokhanov;1990;; Waders of the Kandalaksha Bay in summertime. (in Russian); Ornitologiya.  (Ornithology); Moscow;24;151-152;1990; Waders of the Kandalaksha Bay in summertime. (in Russian);6050; White Sea, Waders, Distribution;;;
  Book Section;763; V. D. Kokhanov;1990;;Steller's Eider - Polysticta stelleri Pallas. 1769;; Murmansk;;161-163;;Steller's Eider - Polysticta stelleri Pallas. 1769;; Barents region, Steller's Eider, Distribution, Number;; Russian;
;748; A. S. Koryakin;1990;; Anthropogenic disturbance and seabirds breeding communities in Kandalaksha Bay;; Moscow;;26-38;; Anthropogenic disturbance and seabirds breeding communities in Kandalaksha Bay;; Kandalaksha Bay, Seabirds number, Common Eider, Conservation;; Russian;
;749; A. S. Koryakin;;; Disturbance is a threat for seabirds of the White Sea;;1990;;189-190; September; Disturbance is a threat for seabirds of the White Sea;; White Sea, Seabirds number, Disturbance, Conservation;;;
  Book Section;762; A. S. Koryakin, Krasnov, Yu.V., Tatarinkova, I.P.;1990;; About large gulls preying оn Common Eider ducklings;; Moscow;;159-169;; About large gulls preying оn Common Eider ducklings;; Common Eider, Gulls, Barents Sea, White Sea, Behavior, Breeding, Predator;; Russian;
;409; Y. V. Krasnov;1990;; Nesting of Great Skua (Stercorarius skua) in the USSR; Izuchenie morskikh kolonialnykh ptits v SSSR. (Informatsionnye materialy). (Colonial seabird-study in the USSR. Info materials); Magadan;;47-48;1990; Nesting of Great Skua (Stercorarius skua) in the USSR;4400; Barents Sea, Murman, Great Skua, Breeding, Distribution;; Russian;
;903; Y. V. Krasnov;1990; Zoologicheski zhurnal (Zoological journal); Alternative foraging strategies for seagulls;;;69;67-72;; Alternative foraging strategies for seagulls;;;; Russian;
;796; T. S. Ponomareva;;; Possibilities and perspectives for eider down harvesting in the White Sea;;1990;;191-192;September 1990; Possibilities and perspectives for eider down harvesting in the White Sea;; White Sea, Common Eider, Management and protection;; Russian;
;554; T. N. Savinova;1990;; Chemical pollution in the nothern seas;; Apatity;;146;1990; Chemical pollution in the nothern seas;5240; Barents Sea, Many orders, Pollution;; Russian;
;797; V. Y. Semashko and A. E. Cherenkov;;; Nesting of seabirds on some islands in the Onega Bay of the White Sea;;1990;;193-194;September 1990; Nesting of seabirds on some islands in the Onega Bay of the White Sea;; White Sea, Seabirds distribution, Seabirds number;; Russian;
;798; V. Y. Semashko and A. E. Cherenkov;;; Common Eider in Solovetskii Archipelago;;1990;;194-195;September 1990; Common Eider in Solovetskii Archipelago;; White Sea, Common Eider, Distribution, Number;; Russian;
;585; N. N. Skokova;1990;; The Puffin. (in Russian); Ptitsy SSSR. Chistikovye. (Birds of the USSR. Alcids); Moscow;;148-164;1990; The Puffin. (in Russian);5310; Barents Sea, Murman, Puffin, Distribution, Breeding, Diet, Foraging, Behaviour, Predators, Disturbance, Habitat, Management, Phenology;;;
  Book;633; I. P. Tatarinkova and A. N. Golovkin;1990;; The Razorbill. (in Russian); Ptitsy SSSR. Chistikovye. (Birds of the USSR. Alcids); Moscow;;16-25;1990; The Razorbill. (in Russian);5630; Barents Sea, White Sea, Razorbill, Population size, Breeding, Diet, Distribution, Predators, Behaviour, Management, Biometry, Habitat;;;
  Book;634; I. P. Tatarinkova and A. N. Golovkin;1990;; Black Guillemot. (in Russian); Ptitsy SSSR. Chistikovye. (Birds of the USSR. Alcids); Moscow;;56-66;1990; Black Guillemot. (in Russian);5640; Barents Sea, White Sea, Black Guillemot, Distribution, Population size, Biometry, Breeding, Diet, Behaviour, Management, Predators, Habitat, Phenology;;;
  Book;165; A. E. Cherenkov, Semashko, V. Yu.;1991;; Larids of Solovetskie Islands. (in Russian); Sovremennaya ornitologiya. (Modern ornithology); Moscow;;184-196;1991; Larids of Solovetskie Islands. (in Russian);6190; White Sea, Larids, Distribution, Population  size, Management;;;
  Book;223; M. V. Gavrilo;1991;; The chicks of the Brunnich guillemot leave the colony in the Ingeborgfjellet. (in Russian); Izuchenie morskikh colonialnykh ptits v SSSR (Study of sea colonial birds in the USSR). Inf.mat.; Magadan;;14-18;1991; The chicks of the Brunnich guillemot leave the colony in the Ingeborgfjellet. (in Russian);2610; Barents Sea, Svalbard, Brunnich Murre, Breeding, Behavior;;;
  Book;260; A. N. Golovkin;1991;; Kittiwake nesting on the buildings of Barentsbourg (West Spitsbergen). (in Russian); Izuchenie morskikh kolonialnykh ptits v SSSR, informatsionnye materialy (Colonial seabird-study in the USSR, inf. mat.); Magadan;;18-20;1991; Kittiwake nesting on the buildings of Barentsbourg (West Spitsbergen). (in Russian);2950; Barents Sea, Svalbard, Kittiwake, Breeding;;;
  Thesis;261; A. N. Golovkin;1991;; Colonial birds and the system of marine biocenosyses. (in Russian). (Kolonialnye ptitsy v sisteme morskikh biotsenozov);; Moscow;;400;1991; Colonial birds and the system of marine biocenosyses. (in Russian). (Kolonialnye ptitsy v sisteme morskikh biotsenozov);6600; Barents Sea, White Sea, Alcids, Gulls, Distribution, Populalation size, Diet, Foraging, Prey stock, Bird impact;;;
  Conference Proceedings;751; A. S. Koryakin;;; Defensive behavior of the Common Eider;;1991;2;306-307;17-20 September; Defensive behavior of the Common Eider;; Common Eider, Behavior, White Sea;; Russian;
;410; Y. V. Krasnov;1991;; The main tendency of population-development and the protection seabirds in the Barents Sea. (in Russian); Ecologicheskaya situatsiya i okhrana flory i fauny Barentseva morya. (The ecological situation and protection of flora and fauna of the Barents Sea); Apatity;;55-63;1991; The main tendency of population-development and the protection seabirds in the Barents Sea. (in Russian);4410; Barents Sea, Murman, Gulls, Alcids, Population trend, Foraging, Prey stock;;;
  Conference Proceedings;756; Y. V. Krasnov, Nikolaeva, N.G.;;; Human impact on seabird colonies in the Eastern Murman;;1991;2;319-320;17-20 September; Human impact on seabird colonies in the Eastern Murman;; Barents Sea, Murman, Conservation, Anthropogenic disturbance;; Russian;
;498; V. A. Paevski, Karelina, L. D.;1991;; Ornithological observations on the south-east coast of the Onega Bay. (in Russian); Ornitologiya. (Ornithology); Moscow;25;169-170;1991; Ornithological observations on the south-east coast of the Onega Bay. (in Russian);5010; White Sea, Many orders, Distribution;;;
  Book Section;806; T. S. Ponomareva, Semashko, V.Yu., Cherenkov, A.E.;1991;; The Common Eider (Somateria mollissima) in the Solovetski Archipelago, White Sea;; Moscow;25;40-45;; The Common Eider (Somateria mollissima) in the Solovetski Archipelago, White Sea;; White Sea,Common Eider;Studies of the breeding biology of the Common Eider was carried out on Solovetski Islands in 1985-1988 and on other islands of the Onega Bay, White Sea in 1987-1988. Some features of nesting biology, bird number changes, breeding success and its contraints are discussed. Protection measures for Common Eider in the region are proposed.; Russian;
;921; F. N. Shklyarevich;;; Kittiwake is a new nesting species of the White Sea;;1991;2;298;; Kittiwake is a new nesting species of the White Sea;;;; Russian;
;627; I. P. Tatarinkova;1991;; The nesting of Kittiwake at the Ainov Islands (Western Murman). (in Russian); Izuchenie morskikh kolonialnykh  ptits v  SSSR. Informatsionnye materialy. (Colonial seabird-study in the USSR. Info  materials); Magadan;;64-66;1991; The nesting of Kittiwake at the Ainov Islands (Western Murman). (in Russian);5610; Barents Sea, Murman, Kittiwake, Breeding;;;
  Book;628; I. P. Tatarinkova;1991;; The number and distribution of the Great Black-backed Gull and Herring Gull of the Murman. (in Russian); Izuchenie morskikh  kolonialnykh ptits v SSSR.  Informatsionnye materialy. (Colonial seabird study in the USSR. Info materials); Magadan;;62-64;1991; The number and distribution of the Great Black-backed Gull and Herring Gull of the Murman. (in Russian);5620; Barents Sea, Murman, Great Black-backed Gull, Herring Gull, Population size, Distribution;;;
  Conference Proceedings;913; V. V. Bianki, Boiko, N.S.;;; The Herring Gull in the inner part of the Kandalaksha Bay;;1992;;78-81;; The Herring Gull in the inner part of the Kandalaksha Bay;;;; Russian;
;752; A. S. Koryakin;;; The common eider of the White Sea under human impact ;;1992;;28-32; September; The common eider of the White Sea under human impact ;; White Sea, Common Eider, Anthropogenic disturbance;; Russian;
;795; T. S. Ponomareva;1992; Byulleten MOIP, otd. biol. (Bulletin of the Moscow Society of Nature explorers. Biol. department); Barnacle Goose nesting in Kolguyev Island Region;;;97;39-44;; Barnacle Goose nesting in Kolguyev Island Region;; Barnacle Goose, Barents region, Kolguev Island, Distribution, Number;; Russian;
;555; T. N. Savinova;1992;; Contaminants in the seabirds of the Barents Sea: results and research perspectives. (in Russian); Teoreticheskie podkhody k izucheniyu ekosistem morey Arktiki i Subarlktiki. (Theoretical aproaches to the study of Arctic and Subarctic sea ecosystems); Apatity;;113-116;1992; Contaminants in the seabirds of the Barents Sea: results and research perspectives. (in Russian);5250; Barents Sea, Many orders, Pollutants;;;
  Journal Article;133; V. V. Biancki, Kokhanov, V. D., Koryakin, A. S., Krasnov, Yu. V., Paneva, T. D., Tatarinkova, I. P., Chemyakin, R. G., Shklyarevich, F. N., Shutova, E. V.;1993; Russki ornitologicheski zhurnal. (Russian ornithological journal); Birds of the Kola Peninsula and the White Sea region. (in Russian);;;2;491-586;1993; Birds of the Kola Peninsula and the White Sea region. (in Russian);4230; Barents Sea, Murman, White Sea, Many Orders, Phenology, Breeding, Movements; Concrete longterm data are given in the tables: occurence of the common and the vagrant species, first sighting in spring, start of egg laying, dimensions of eggs, size of clutch, onset of hatching, hatching dates on five days scale, last sighting in autumn;;
  Journal Article;374; V. D. Kokhanov;1993; Russki ornitologicheski zhurnal. (Russian ornithological journal); Little Gull Larus minutus nesting at the Kola Peninsula. (in Russian);;;2;256-257;1993; Little Gull Larus minutus nesting at the Kola Peninsula. (in Russian);4220; Little Gull, Breeding, Distribution;;;
  Journal Article;453; K. E. Michailov;1993; Russki ornitologicheski zhurnal.(Russian ornithological journal); Avifauna of the zonal tundras in the northern part of the Kola Peninsula. (in Russian);;;2;7-28;1993; Avifauna of the zonal tundras in the northern part of the Kola Peninsula. (in Russian);4880; Barents Sea, Murman, Many orders, Tundra, Distribution;;;
  Book;472; Y. N. Mineev;1994;; Waterbirds of the Yugorski Peninsula;; Syktyvkar;;103;1994; Waterbirds of the Yugorski Peninsula;4870; Barents sea, Nenets District, Geese, Ducks, Distribution, Population size, Breeding, Tundra;;;
  Book;556; T. N. Savinova, Gabrielsen, G.V.;1994;; Chlorinated hydrocarbons and heavy metalls in the birds of the Barents Sea;; Apatity;;36;1994; Chlorinated hydrocarbons and heavy metalls in the birds of the Barents Sea;5260; Barents Sea, Many orders, Pollutants;; Russian;
;772; V. N. Kalyakin;1995; Doklady academii nauk (Doklady Biological Sciences); New data on biogeographical unique status of Novaya Zemlya;;;343;139-141;; New data on biogeographical unique status of Novaya Zemlya;; Novaya Zemlya, Seabirds distribution, Waterfowl distribution;; Russian;
;777; V. N. Kalyakin;1995;; On breeding of the Great Skua (Stercorarius skua) at Vaigach ;; Moscow;26;72-75;; On breeding of the Great Skua (Stercorarius skua) at Vaigach ;; Vaigach Island, Great Skua, Breeding biology; The Great Skua is found as a breeding bird at Vaigach island for the first time. The record confirm further eastward expansion of the species.; Russian with English summ;
;757; Y. V. Krasnov, Nikolaeva, N.G.;1995;; Changing of the status of the Great Skua (Stercorarius skua); Ornitologiya (Ornithology); Moscow;26;188-189;; Changing of the status of the Great Skua (Stercorarius skua);; Barents Sea, Murman, Great Skua, Breeding biology;; Russian;
;758; Y. V. Krasnov;1995;; Seabirds (retrospective analysis of population dynamics);; Apatity;;138-147;; Seabirds (retrospective analysis of population dynamics);; Barents Sea, Novaya Zemlya, Seabirds, Population dynamics, Distribution;; Russian;
;755; Y. V. Krasnov, G. G. Matishov, K. V. Galaktionov and T. N. Savinova;1995;; Murman's colonial seabirds;; St-Petersburg;;224;; Murman's colonial seabirds;; Barents Sea, Seabirds, Population dynamics, Food and feeding, Pollution, Parasites;In the 1960—1980s in the Barents Sea the forage base of seabirds was being affected by commercial fishery of hydrobionts. Depending on the fishery influence on fish flocks of either species, these changes played sometimes a positive role and provided an increase of food resources for some species (for example, kittiwakes). But in general even in the end of the 1960s, a stable negative tendency towards degradation of the seabird forage base arised in the Barents Sea. In the course of its rapid changes, sand eel became the principal food resource providing breeding of the most Murman seabirds. Due to these changes, the high-specialized fish-eating seabirds (guillemots and cormorants) got into serious troubles. Under existence of the traditional forage base they avoid any interspecific food competition owing to catching of different size groups of the same species and to searching them in different regions and at different depths. Different combinations of these opportunities permitted bird divers to use completely food resources around their colonies. Ichthyofauna changes resulted in transformation of trophic connections between seabirds and provoked increase of competition between them, whereas neutralization mechanisms were unsufficient under drastic decrease of fish resources. Finally, this process may result in forming of new food niches and some alterations of divers' number according to the current state of trophic conditions at the Murman.; Russian with English summ;
;779; V. F. Muzhchinkin;1995;; Birds recorded on the Franz Josef Land;; Moscow;26;191-192;; Birds recorded on the Franz Josef Land;; Franz Josef Land, Seabirds distribution;; Russian;
;778; T. S. Ponomaryova;1995;; Nesting ornithofauna of the environs near Kolguev Island;; Moscow;26;92-96;; Nesting ornithofauna of the environs near Kolguev Island;; Kolguev Island, Waterfowl number, Gulls number;Data on the nesting ornithofauna in sandy shallows near Kolguyev Island, the Barents Sea, are given in the paper. Totally around 330 Larus Hyperboreus, 300 Branta leucopsis, 125—130 Larus argentatus heuglini nests have been registered. A colony of Sterna paradisaea, consisting of 50 pairs, a few nests of Somateria mollissima and S. spectabilis nests of Mergus serrator and some other species have been discovered.; Russian with English summ;
;780; I. P. Tatarinkova, Chemyakin, R.G.;1995;;Anusual appearance of the Gannets (Sula bassana) near Ainovy Islands, Murmansk coast in autumn 1988;; Moscow;26;197;;Anusual appearance of the Gannets (Sula bassana) near Ainovy Islands, Murmansk coast in autumn 1988;; Murman Coast, Ainov Islands, Gannet;; Russian;
;773; S. V. Zyryanov;1995;; Birds;; Apatity;;110-116;; Birds;; Barents Sea, Murman Coast, Seabirds conservation;; Russian with English summ;
;739; V. V. Bianki;;; On changes in the bird population nesting in the Kandalaksha Skerries;;1996;;31-33;28.jul; On changes in the bird population nesting in the Kandalaksha Skerries;; White Sea, Kandalaksha Bay, Seabirds number;; In Russian with English summ;
;904; Y. V. Krasnov, Nikolaeva, N.G.;1996;;Distribution of seabirds in the southeastern part of the Barents Sea in July 1993;; Apatity;;98-104;;Distribution of seabirds in the southeastern part of the Barents Sea in July 1993;;;; Russian;
;905; Y. V. Krasnov, Nikolaeva, N.G.;1996;; Current distribution of colonial seabirds in the Barents Sea;; Apatity;;101-113;; Current distribution of colonial seabirds in the Barents Sea;;;; Russian;
;740; V. V. Bianki, Boiko, N.S.;;; Western Ryashkov Salma significance for the birds (Kandalaksha Bay of the White Sea);;1998;;29-35;3-5 August; Western Ryashkov Salma significance for the birds (Kandalaksha Bay of the White Sea);; White Sea, Kandalaksha Bay, Seabirds number;; In Russian and English;
;766; V. N. Karpovich, Shklyarevich, G.A.;1997;; On possibility of Common Eider dynamics in Kandalaksha reserve depending on natural fluctuation of biomass Blue Mussels;; Apatity;;44-66;; On possibility of Common Eider dynamics in Kandalaksha reserve depending on natural fluctuation of biomass Blue Mussels;; Kandalaksha Bay, Common Eider, Population dynamics, Feeding;; Russian;
